query_id,relevance_type,answer_id,relevance,answer_n,query_text,answer_text
3411123,Q0,3411123_4,0.0,4,'Why doesn't America accept foreign credentials?',"Welcome to the Catch-22 of education and educated people.  It gets worse, you can be credited/certified in one State, but not another without ""further"" testing and courses.  Then Standards differ from not just one State to the next, but from one place of higher learning to another.  There may be ""universal precautions"" with AIDS, but there is nothing universally accepted about education; experience or abilities.  I believe its called ""hoop-jumping"" and it is still a waste of human potential and knowledge.  Good luck to you and don't quit pursuing your dreams."
3411123,Q0,3411123_7,1.0,7,'Why doesn't America accept foreign credentials?',"Standards vary from country to country. If i went to Italy although a CPA in the US, I could not immediately be employed at the same level. Do the internship, show what you got, my experience is that people outside the US have a far superior education than those here; but you have to prove it first."
3411123,Q0,3411123_6,0.6666666666666666,6,'Why doesn't America accept foreign credentials?',"You think other countries accept American credentials?  I doubt it, unless they're desperate for a specific type of professional.. . Each country has different building materials and cultural and natural challenges.  If you're education is close enough to US standards, you should be able to quickly apply what you've learned in an internship (and make good $$$ while doing it, too!)  The the certification should be a breeze for you."
3411123,Q0,3411123_8,1.0,8,'Why doesn't America accept foreign credentials?',"I think maybe the question might be a little off.  In your particular position it might be true but in honesty in lots of positions such as doctors, they will usually be hired quicker than Americans as usually they will work cheaper although still making great wages.  Locally here, a J-1 doctor with no experience will hire in as soon as they enter the country for about 150K per year with another 100k in perks where an American doctor won't even consider an offer like that.  I saw a couple years back an American OBGYN hire in at a company with a 200K sign in bonus, $200K per year salary, 1/2 of the overall money she generated on top of that, $500/month cell phone allowance, and $700/month rental allowance."
2814599,U0,2814599_0,1.0,0,'What does it mean when someone with cancer is in remission?',"Remission: Disappearance of the signs and symptoms of cancer or other disease. When this happens, the disease is said to be ""in remission."" A remission can be temporary or permanent."
2814599,Q0,2814599_1,1.0,1,'What does it mean when someone with cancer is in remission?',"It doesn't mean five years or more cancer free, though some consider themselves cured after being cancr free for five years or more.  Remission means the symptoms are gone and the cancer is not growing.  As soon as this happens you are in remission baby!"
2814599,Q0,2814599_2,0.6666666666666666,2,'What does it mean when someone with cancer is in remission?',5 years or more cancer free.
2814599,Q0,2814599_3,1.0,3,'What does it mean when someone with cancer is in remission?',Well say the doctor said to me that my mom was on her 6th year of remission it means that she has had no cancer cells in her body. And it also means thats how long the cancer has been gone for! Does that help? Good I hope it did!
2814599,Q0,2814599_4,0.3333333333333333,4,'What does it mean when someone with cancer is in remission?',i had treatment 2 years ago and went into remission now the cancer is back alot worse than the first two times that i have had it. the cancer is still there but it dont hurt you in less it is active.
2814599,Q0,2814599_5,0.0,5,'What does it mean when someone with cancer is in remission?',<Remission is the state of absence of disease activity in patients with known chronic illness. It is commonly used to refer to absence of active cancer or inflammatory bowel disease
100653,U0,100653_1,1.0,1,'How can I get copies of letters of praise from the city of San Diego?',Use a copy machine.  Or scan the letter into your computer and print it out in color mode to pick up any logos on the original letterhead.
100653,Q0,100653_0,0.6666666666666666,0,'How can I get copies of letters of praise from the city of San Diego?',Call the city secretary they should be able to help you from there. Or try whatever department that you have had dealings with in the past.
1351675,U0,1351675_0,1.0,0,'Why do I need a windshield that hasn't been broken to pass a safety check for my car?',For your own safty. Windshields are made up of vinyl sandwiched between two pieces of glass. If this is compromised the structural safty of the windshield is destroyed. What once would protect you from objects coming in and you flying out is no longer.
1351675,Q0,1351675_1,1.0,1,'Why do I need a windshield that hasn't been broken to pass a safety check for my car?',Because cracks often unexpectedly grow larger and can quickly cloud your field of vision making your car really dangerous.  It's happened to me before.
1351675,Q0,1351675_2,0.3333333333333333,2,'Why do I need a windshield that hasn't been broken to pass a safety check for my car?',iv'e never had to replace a cracked windshield for safety unless it was in the drivers line of vision(like u said).. maybe the mechanics just being sticky.. try smashing the entire window out and tell him it's a brand new clean one.ha ha
1351675,Q0,1351675_3,0.3333333333333333,3,'Why do I need a windshield that hasn't been broken to pass a safety check for my car?',"Well, since the mecahnics are trying to replace the inspection stickers by using some kind of tool, it's best to have an uncracked windshield, eventhough the crack doesn't interfere with your road viewing. They can try to take off the old sticker with a cracked windshield but if not careful, results can be messy. Hopefully, this is helpful."
4365565,U0,4365565_1,1.0,1,'What Makes Water Push?',"At your home, a water utility supply line into your home is typically only 1 inch in diameter.  This 1 inch pipe is split multiple time to route water to every watter connection in your home i.e toilet, shower, sink, outside faucet.  Each of these connections is typically only 1/2 inch...so the more open lines a home has the lower the pressure will be, as the incoming pressure from the water company is held fairly constant."
4365565,Q0,4365565_2,1.0,2,'What Makes Water Push?',In your house? Most cities have water towers. As the tower gets fuller the pressure goes up. As you use the water it gradually goes down. Most cities have automated systems when the tower or pressure gets so low pumps are activated to refill the tower. This is the basics. Alot more involved in the treatment and other processes.
4365565,Q0,4365565_3,1.0,3,'What Makes Water Push?',"Well it depents on the source of water supply, if it provides higher pressure then more water will pour out the hose. Water consumers also affects it, if there are consumption occuring from the same supply then the pressure gets lower.. . Altitude doensn't affect that much."
4365565,Q0,4365565_0,0.6666666666666666,0,'What Makes Water Push?',Could be a leak. The water flowing in to the hot water heater. Maybe the valve for the hot water heater is not opened enough.
551239,U0,551239_0,1.0,0,'how can i check if someone gave me a life insurance policy?',"if your dad listed you as one of the beneficiary, you have the right to access the money. Call the insurance company for questions."
551239,E0,551239_2,0.6666666666666666,2,'how can i check if someone gave me a life insurance policy?',I hate matters concerning this.  Have you tried to contact a probate attorney?  Maybe he can answer your initial questions.
551239,E0,551239_1,1.0,1,'how can i check if someone gave me a life insurance policy?',Try to find out the name of the insurance company. . . Contact your fathers lawyer to see if he knows. . . Who read the will? It could be in there.. . Go online to http://forum.freeadvice.com/archive/index.php/t-118536.html for free legal advise. . or. . http://www.inheritancefunding.com/landingG.asp?source=GT&gclid=CKSLyZWR34QCFQ1dJAodAyQlZw to see if they can figure it out
2862887,U0,2862887_0,1.0,0,'How to take care of a dragon with spikes and what to give them to eat?',"Most of the ""Dragons"" are bearded, chinese, or giant mountain horned lizards. You can give them crickets, meal worms, wax worms, red wigglers, try to also give some romain lettuce, shredded beets, shredded cucumbers, with a little peach baby food as a ""salad dressing"""
2862887,Q0,2862887_1,1.0,1,'How to take care of a dragon with spikes and what to give them to eat?',live crickets are the best choice in food.  Make sure the full size of the cricket is smaller than the mouth.  You should also mist them with water a few days a week as well as giving them some sort of water dish.  Handle them regularly or they can become aggressive.
2862887,Q0,2862887_3,0.0,3,'How to take care of a dragon with spikes and what to give them to eat?',Young Princes with big swords.
2862887,Q0,2862887_2,0.6666666666666666,2,'How to take care of a dragon with spikes and what to give them to eat?',if its a berded dragon which it probly is you feed it shreaded lettus meo-worms and water
2862887,Q0,2862887_4,0.6666666666666666,4,'How to take care of a dragon with spikes and what to give them to eat?',ask u local vet or pet shop just call
1957887,U0,1957887_0,1.0,0,'How can I find and stop the people that send me unwanted messages?',I would just punch every 20th person you see.  You're bound to get an accurate percentage and at least a few real spammers.
1957887,Q0,1957887_10,0.3333333333333333,10,'How can I find and stop the people that send me unwanted messages?',i wish i knew how to spam them back without commiting a crime or damaging my comp.
1957887,Q0,1957887_4,0.0,4,'How can I find and stop the people that send me unwanted messages?',yes.
1957887,Q0,1957887_9,0.3333333333333333,9,'How can I find and stop the people that send me unwanted messages?',"u can try, but u can always try to unscribed to it."
1957887,Q0,1957887_8,0.3333333333333333,8,'How can I find and stop the people that send me unwanted messages?',you use a spam blocker so you dont have to track them down and beat them
1957887,Q0,1957887_1,0.3333333333333333,1,'How can I find and stop the people that send me unwanted messages?',"I don't know if there is phuysically a way, but that would be great!"
1957887,Q0,1957887_3,0.6666666666666666,3,'How can I find and stop the people that send me unwanted messages?',"you can't and don't need to, they are looking for a reaction from you, just ignore them, they are stupid."
1957887,Q0,1957887_2,0.6666666666666666,2,'How can I find and stop the people that send me unwanted messages?',"Hey, I feel your ire. I'd really like it if Yahoo came up with a button you could push, that would go right to the computer that sent you the spam in your inbox, and wipe out their hard drive! That would be the ultimate in technology. Especially if it protects your computer from them coming back to your hard drive. Yes, I know that it would eventually be abused, but it's fun just to consider, huh?! <*)))><"
1957887,Q0,1957887_5,0.6666666666666666,5,'How can I find and stop the people that send me unwanted messages?',"Look for their IP address in the ""technical stuff"" of the e-mail.  This may be a permanent location, so you can go and have a chit-chat with the person who is spamming you.  you may also follow the chain in this "":tech stuff."""
1957887,Q0,1957887_7,0.3333333333333333,7,'How can I find and stop the people that send me unwanted messages?',learn how 2 hack their acounts and hack em
1957887,Q0,1957887_6,0.6666666666666666,6,'How can I find and stop the people that send me unwanted messages?',Just BLOCK their website on your email and keep blocking them til pretty soon you don't see that anymore.
714612,U0,714612_0,1.0,0,'Why doesn't the water stay on the earth if it's round?',This goes along with the question of why don't we fall off the earth if it is round. The answer is because gravity is holding us (and the water) down.
714612,Q0,714612_10,0.6666666666666666,10,'Why doesn't the water stay on the earth if it's round?',"one thing you might want to consider with this one is the center of mass, since that is where the bulk of the pull from gravity will come. Try it out with a basketball/any spherical object. If you put your finger on the surface and were pulled in to the center, look at the direction your finger would have to move: straight down, not off the edge."
714612,Q0,714612_1,1.0,1,'Why doesn't the water stay on the earth if it's round?',same reason why people in south (e.g australia) don't fall off earth - earth's gravitational pull.
714612,Q0,714612_8,1.0,8,'Why doesn't the water stay on the earth if it's round?',Gravity pushes it down just like it does to everything else on Earth.
714612,Q0,714612_9,0.3333333333333333,9,'Why doesn't the water stay on the earth if it's round?',Because god made it were the earth is like a bowl but the bowl has and dip and the earth dont the earth pokes out but . there is holes in the earth
714612,Q0,714612_2,0.3333333333333333,2,'Why doesn't the water stay on the earth if it's round?',The world isn't round. It's a cube.
714612,Q0,714612_3,0.3333333333333333,3,'Why doesn't the water stay on the earth if it's round?',same reason the people don't
714612,Q0,714612_6,0.3333333333333333,6,'Why doesn't the water stay on the earth if it's round?',"Are you sure it doesn't?  Put some red food coloring in a glass of water.  Put just one drop into the ocean.  Now quick, jump in your boat and follow it.  Where does it go? Perhaps it does fall off.  Please give us a full report when you get back."
714612,Q0,714612_7,1.0,7,'Why doesn't the water stay on the earth if it's round?',because there is no gravity strong enough around earth for water to fall of the earth
714612,Q0,714612_4,0.6666666666666666,4,'Why doesn't the water stay on the earth if it's round?',Look up : GRAVITATION !!!
714612,Q0,714612_5,1.0,5,'Why doesn't the water stay on the earth if it's round?',Gravity....of course!
421753,U0,421753_5,1.0,5,'how to make a skunk go away?',"Once i got the product 'Shake Away', I've never had another problem with these critters..and it's not cruel or painful to them...instead it contains the scent of the skunks most feared enemy which is the fox. It's inbred in skunks to natually fear the fox and when they smell the 'Shake-Away' that's sprinkled on the ground --- they flee and never come back."
421753,Q0,421753_20,0.6666666666666666,20,'how to make a skunk go away?',Need more info as to why you want it gone. . . Respect nature!  Skunks are not usually a problem unless your dog/cat messes with it.. . This question has been aswered multiple times already - do a search.
421753,E0,421753_19,0.3333333333333333,19,'how to make a skunk go away?',i just saw someone on here that wants one for a pet call him
421753,E0,421753_18,0.0,18,'how to make a skunk go away?',got a 22?
421753,Q0,421753_1,1.0,1,'how to make a skunk go away?',"we live in the country so these Lil' critters like to make their themselves  known on occasion. They only spray when they get scared so if you run into one face to face just back away slowly and they will go the other. Don't get excited and less you want sprayed. To keep them away from areas you don't want them sprinkle black pepper in that area about once per week and again after a good rain storm, they hate the smell and will back away quickly, soon they will remember that area has that smell and not bother to come around. Keep all outside pet food picked up for the are looking for food. keep trash picked up and get rid of it daily if possible or keep in tightly sealed cans. And NEVER EVER let your dog chase them off unless you want to be washing it up the next few days. Good Luck"
421753,E0,421753_13,0.3333333333333333,13,'how to make a skunk go away?',catch it's smell and throw it in it's face.
421753,Q0,421753_12,0.3333333333333333,12,'how to make a skunk go away?',easy. eat it and hang its skin on your door so it will be an example. of what you will do to any other skunk that waddles over to your house
421753,Q0,421753_11,1.0,11,'how to make a skunk go away?',"i dont suppose you have an anti aircraft gun just lying around the house, do you?  they work great.  if not, dig a small hole and put a mouse trap in there (the ones that snap shut).  cover it with grass and put whatever skunks eat on top.  also great fun with birds :)"
421753,Q0,421753_10,0.6666666666666666,10,'how to make a skunk go away?',Call the police or the aspa.
421753,E0,421753_17,0.3333333333333333,17,'how to make a skunk go away?',shoot it
421753,Q0,421753_16,0.6666666666666666,16,'how to make a skunk go away?',call some knid of animal shelter. they will probably get someone to get it away.
421753,E0,421753_15,0.0,15,'how to make a skunk go away?',RUN!!!!!!!!!!!!!!!!!!!!!!!!!!!!!!!!!!!!!!!!!!!!!!
421753,Q0,421753_14,0.6666666666666666,14,'how to make a skunk go away?',"Leave it in the backyard or whatever, then call animal shelter?"
421753,Q0,421753_9,1.0,9,'how to make a skunk go away?',contact animal control-they will set a trap
421753,Q0,421753_8,0.3333333333333333,8,'how to make a skunk go away?',shoot it in the back
421753,Q0,421753_7,1.0,7,'how to make a skunk go away?',"Google the National Trappers Association, or your states trappers association, find a nuisance trapper near you and he or she will be able to get rid of the skunk for you without it spraying. A reliable nuisance trapper will have a spray-no pay policy. The best product to get rid of the smell is called Skunk Off. . Remember that just because you are calling a trapper doesn't mean the animal will be destroyed or hurt. The trapper will use a live-trap and may release the skunk far enough away from you that it will not become a problem again.. Forget the lemon or tomato juice.... and good luck!"
421753,Q0,421753_6,0.6666666666666666,6,'how to make a skunk go away?',"actually, this was the tip I got from animal control, which is very odd, but they swear by it....urinate on your property line..... . sounds wacky, but it keeps them away."
421753,Q0,421753_4,0.6666666666666666,4,'how to make a skunk go away?',"we just had a family of 6 skunk babies picked up by our local animal ""rescue"" group.  The mom was nowhere to be found.   You might check in your local phone book for a wild life rescue group. They had nested under a home that was the site of a large community festival."
421753,E0,421753_3,0.6666666666666666,3,'how to make a skunk go away?',Spray it with Febreez
421753,Q0,421753_2,0.6666666666666666,2,'how to make a skunk go away?',Animal Control will take it away for you.
421753,E0,421753_0,0.6666666666666666,0,'how to make a skunk go away?',Lure it out with food. However make sure the skuks tail stays down or..... Well lets just say it will really stink when it's up.
746920,U0,746920_0,1.0,0,'How can you remove a wart from your hand without going to the doctor?',Tie a piece of hair tightly around it. Guaranteed
746920,Q0,746920_5,0.0,5,'How can you remove a wart from your hand without going to the doctor?',bury a penny in the garden
746920,Q0,746920_4,1.0,4,'How can you remove a wart from your hand without going to the doctor?',"put an aspirin on the wart and wrap duct tape (silver furnace tape) completely around the wart. Make sure there is absolutely no way air can get to it.. remove it after 7 days and check to see if the wart is still there, if so repeat for another 7 days with fresh tape and aspirin. If you're allergic to aspirin then skip it and wait 14 days before unwrapping the tape.. . Another remedy that wors better and doesn't make you look silly for a week.. is find a man who is the 7th son (meaning he has 6 older brothers) and have him 'rub away' the wart. All he has to do is rub his thumb over the wart for a few seconds.. when you forget about it, it'll be gone.. .   My two oldest boys had gotten warts all over their hands and I had a 7th son rub them off. About 6 weeks later, I had forgotten about it and went to take the boys to the doctor to get rid of them before school started, and the youngest one's warts were gone. The oldest didn't believe they'd be gone and they weren't but the youngest did believe. It really works. Another thing is go to your doctor and ask him or her to use crushed up blister beetle on the wart, it'll go away in about a week. Good luck"
746920,Q0,746920_7,0.3333333333333333,7,'How can you remove a wart from your hand without going to the doctor?',Get a pair of finger nail clippers and clip it off.
746920,Q0,746920_6,1.0,6,'How can you remove a wart from your hand without going to the doctor?',Dr. Scholls wart remover.
746920,Q0,746920_1,0.6666666666666666,1,'How can you remove a wart from your hand without going to the doctor?',"my sister use to get them on her hands and my mom would put clear nail polish on them.  Something about keeping oxygen from it made it go away I think?!  Hope it helps, worth a shot, and sounds a lot less painful than some of the other suggestions I've read above?!"
746920,Q0,746920_3,1.0,3,'How can you remove a wart from your hand without going to the doctor?',"Try covering it up with duct tape. For some reason it can work, but the best results are with combination with freezing, etc."
746920,Q0,746920_2,1.0,2,'How can you remove a wart from your hand without going to the doctor?',The new freeze-off stuff works really well and is available over the counter.
746920,E0,746920_9,1.0,9,'How can you remove a wart from your hand without going to the doctor?',"Grandfather Gus returned with a tin of grease, and my grandmother spread it freely over the wound. The bleeding stopped immediately and in a few hours she cleaned the wound, dabbed it with a little coal oil, and tied a strip of white cloth around my chest.. . If you grew up in the country, miles away from the nearest doctor, home remedies were something you accepted routinely. Using axle grease or coal oil for cuts probably made pretty good sense, especially if you got well.. . In 1996, we completed ""Rub Onions and Skunk Oil on my Chest and Call Me Well,"" a collection of home remedies and folk medicines. Most of the contributions came from older people who used the folk remedies themselves or remembered parents or grandparents who found the home medicines an essential part of rural life in Texas. We discovered a multitude of cures for warts, but they often fell more into the realm of superstition than remedies.. . Several people told us to rub our warts with a rooster comb, and bury it.. . Ruby Yount of Lufkin said her mother-in-law removed several warts from her kids' hands, and it was all done in privacy. She tied a knot of sewing thread over the wart, then went outside and buried it in the earth. By the time the thread rotted, the wart was gone"
746920,Q0,746920_8,0.3333333333333333,8,'How can you remove a wart from your hand without going to the doctor?',take a potatoe cut it in half bury half of it in the yard the other half goes like this make a small slice in your wart with a knife rub the potatoe all over it then bury that half in the yard under the full moon.
746920,Q0,746920_11,1.0,11,'How can you remove a wart from your hand without going to the doctor?',"Duct tape. That's what my doctor told me to use, and it worked."
746920,Q0,746920_10,1.0,10,'How can you remove a wart from your hand without going to the doctor?',Compound W.  Over the counter stuff you can find at a WalMart of anywhere.
746920,Q0,746920_12,0.6666666666666666,12,'How can you remove a wart from your hand without going to the doctor?',theres a new thing you can get from the chemist which works similar to freezing like what your doctor would do except its cheaper!
3369088,U0,3369088_19,1.0,19,'How can we stop people from following islam?',Limit immigration from Arabic countries. Refuse to listen to religious propaganda. Outlaw all religious propaganda in prisons.
3369088,Q0,3369088_22,0.3333333333333333,22,'How can we stop people from following islam?',"Do what General Pershing did, dip your bullets and blades in pig blood.  If a terrorist is killed with these ""profane"" weapons, they don't go to their paradise.  They will run for the hills."
3369088,E0,3369088_23,1.0,23,'How can we stop people from following islam?',You can't  and people will just have to learn how to deal  with it. It is the fastest growing religions.
3369088,Q0,3369088_20,0.3333333333333333,20,'How can we stop people from following islam?',"it well finish by it self, like many other ancient religions that no longer exists."
3369088,Q0,3369088_21,0.3333333333333333,21,'How can we stop people from following islam?',"You don't. It's none of your business. If people want to convert, they want to convert. It's your place to just BUTT OUT."
3369088,Q0,3369088_24,1.0,24,'How can we stop people from following islam?',"you can't because it is a catch 22.. the more you oppress the muslim, the more they will strive and grow and become determined to survive and spread.  And the more money will pour into religion organisations underground, too.. . the more freedom you give them, the more they will impose their rreligious rights. and they havae the money to do it, too, as long as you leave them to it.. . so no matter what  you do, they will spread.. . The only thing you can wish for is a Christian theocracy that forces all people to be Christian or die by guillotine.  And then  make everyone have dozens of babies till the numbers surpass Islam's.. good luck."
3369088,Q0,3369088_25,0.0,25,'How can we stop people from following islam?',leave it the hands of God....
