query_id,relevance_type,answer_id,relevance,answer_n,query_text,answer_text
4126337,Q0,4126337_8,0.6666666666666666,8,'Why does my friend buy things?',does he have a boyfriend?  or maybe he just uses it when hes alone...
4126337,Q0,4126337_9,0.3333333333333333,9,'Why does my friend buy things?',If you don't know you don't need to know.
4126337,Q0,4126337_6,0.3333333333333333,6,'Why does my friend buy things?',I don't like KY can your recomend a better lube for him to use? Tell him the try Wet when he has you bent over.
4126337,Q0,4126337_4,0.0,4,'Why does my friend buy things?',"IT FEELS GOOD, TRY SOME YOURSELF."
4126337,Q0,4126337_5,0.6666666666666666,5,'Why does my friend buy things?',"looks like ya answered your own question ,.  does not have a girlfriend >> mybe theres a boy friend, or maybe he's useing it for masterbation , or just maybe he's having sex parties that your not invited too ..."
4126337,Q0,4126337_2,0.0,2,'Why does my friend buy things?',"Good question, because KY has all the lubricity of contact cement. My advice: tell your friend that Astroglide is way way better."
4126337,Q0,4126337_3,0.6666666666666666,3,'Why does my friend buy things?',Ask him; he's the only one that knows the answer to that one.
4126337,Q0,4126337_0,0.0,0,'Why does my friend buy things?',Probably uses it to masturbate. Just ask him.
4126337,Q0,4126337_1,0.0,1,'Why does my friend buy things?',"Maybe he's sticking dildos up his butt, which by the way, doesn't necessarily make him gay."
4126337,Q0,4126337_10,0.3333333333333333,10,'Why does my friend buy things?',stay away from him he may use it on u...lol
4126337,Q0,4126337_11,0.0,11,'Why does my friend buy things?',the door squeaks? What a f'in dumbass question.
4126337,E0,4126337_12,0.0,12,'Why does my friend buy things?',self gratification sound like
4126337,Q0,4126337_13,0.0,13,'Why does my friend buy things?',you know why...
4126337,Q0,4126337_14,0.0,14,'Why does my friend buy things?',grow up
667488,U0,667488_1,1.0,1,'When can I start driving on a new driveway?',"It depends on the type of the pavement, quality of the sub grade, exterior temperature and even weight of your vehicle and type of tires.  I would wait at least 48 hrs to make sure that it is safe."
667488,Q0,667488_0,0.6666666666666666,0,'When can I start driving on a new driveway?',pavement is good to go in 8 hours  :)
667488,Q0,667488_2,0.3333333333333333,2,'When can I start driving on a new driveway?',As soon as the highway guys open it... no cones!
1364894,U0,1364894_0,1.0,0,'Why do we have to tell customer service/operator about our sickness to make an appointment with a doctor?',"well usually the customer service rep has a background in medicine, I've worked as an assistant to the doctor for years, and usually when I ask patients..i don't say WHY DO YOU WANT THE DOCTOR?..i usually just ask the patients..what are your symptons, so I can write it down in their file and the doctor knows what he's dealing with. Doctor's are so busy, its nice to give them a little help sometimes..they appreciate it."
1364894,Q0,1364894_4,0.6666666666666666,4,'Why do we have to tell customer service/operator about our sickness to make an appointment with a doctor?',You have to tell them what kind of symptoms you're having so the doctor will know a little bit about it ahead of time and by telling them ahead of time they'll know better if it's serious or not and if they think it's serious then they can make you're appointment sooner and you can't tell this straight to the doctor or nurse over the phone when you make your appointment because they're too busy to schedule appointments too
1364894,Q0,1364894_11,0.3333333333333333,11,'Why do we have to tell customer service/operator about our sickness to make an appointment with a doctor?',"I think they should just make  appointments and let us talk to our doctors about what is wrong.. BUT, I can take this one step further, they also ask if I still have insurance BEFORE they will give me an appointment!! THEY SHOULD NOT BE ASKING THAT!!!!!!!!"
1364894,Q0,1364894_10,1.0,10,'Why do we have to tell customer service/operator about our sickness to make an appointment with a doctor?',They need to know approximately how long your appt will take and how many other people they will be able to schedule in a certain time frame. Basically to maximize their time and their money.
1364894,Q0,1364894_8,0.3333333333333333,8,'Why do we have to tell customer service/operator about our sickness to make an appointment with a doctor?',i really agree with you on this issue...the customer service/operator does not know your condition....what i do is brief it so she can schedule me with the CORRECT doctor...she won't remember you anyway...she has 200 plus calls a day..just tell her your symtoms...that should do it...i hope this helps somewhat...
1364894,Q0,1364894_5,1.0,5,'Why do we have to tell customer service/operator about our sickness to make an appointment with a doctor?',"It's so they know how much time to schedule for the appointment. If it's a minor illness, they'll schedule you for fewer minutes, and for more complicated cases, they'll schedule more time with the doctor. It's only to lessen the time you spend in the waiting room, not necessarily because they're nosy bastards."
1364894,Q0,1364894_9,0.6666666666666666,9,'Why do we have to tell customer service/operator about our sickness to make an appointment with a doctor?',"So they can schedule a long enough appointment for your particular ailment. The people who schedule your appointment are professionals and if they blab, they will be fired!!!"
1364894,Q0,1364894_7,1.0,7,'Why do we have to tell customer service/operator about our sickness to make an appointment with a doctor?',"They might need to know, so they can figure out whether you need to see the doctor ""right away"" or it can wait a few days.. . I don't go into specifics with operators.  Just tell them ""think I have a flu"", or something like that."
1364894,Q0,1364894_6,0.6666666666666666,6,'Why do we have to tell customer service/operator about our sickness to make an appointment with a doctor?',"The operator takes down your major symptoms and allots an appointment based on their (ahem!) 'training'. Apparently they can schedule a longer appointment if necessary.. . Also, the idea is that a staff nurse or the doctor will look through the list of patients/appointments at some point and do some minor 'triage'. If anything jumps out then they will call the patient and have them either come in immediately or visit the Emergency Room at a local hospital.. . Personally, I believe that I could describe my symptoms as, ""I just sawed my leg off,"" and my appointment would still be three weeks away!. . But yes, it is kind of 'icky'.... . ME: ""Hello... yes... well, my penis is twice it's normal size and it's grown two ears and some hair on it's head."". . CS: ""Oh yes, we can fit you in on Tuesday, August 5th 2007. Can you make that time?"""
1364894,Q0,1364894_1,1.0,1,'Why do we have to tell customer service/operator about our sickness to make an appointment with a doctor?',"Well, they need to be able to make a decision about how serious it is. If you broke your nose, you need to be seen soon. If you have a funky wart on you knee, that can wait. They are only trying to help.. . And you don't have to tell them your life story, you know. You can be vauge. Instead of telling them that you've been, say, on your period for a month, you can say you're having a ""girly"" problem.. . They aren't trying to pry, they are just trying to get you the help you need within a reasonable amount of time."
1364894,Q0,1364894_3,1.0,3,'Why do we have to tell customer service/operator about our sickness to make an appointment with a doctor?',The customer service people decide which doctor you need to see. Certain doctors only deal with certain issues. Also the doctor can do some research beforehand to find out what kind of illness you have.. . I think that people who know were they need to go should have direct access to a doctor. Those who are stupid need customer service to guide them to the right doctor.
1364894,Q0,1364894_2,0.3333333333333333,2,'Why do we have to tell customer service/operator about our sickness to make an appointment with a doctor?',"Just tell the operator their are HEPPA laws that prevent you from discussing any med. reasons from answering these questions. If it's a clinic they basically ask you what are your symptoms are so they can quarintine you from other patients. ( i.e. fever,rash,chills) could be something contagious"
4473137,U0,4473137_2,1.0,2,'Why did Christianity become more popular and what happened because of it?',"Corruption - Christian sprang up as the religion on o fthe poor, rich people 'sanitized it' to control the poor with things such as it is easier for a camel to pass through a needle's eye than for the rich to enter the kingdom of god.  Thereby, ensuring the poor has some justification or maybe some light at the end of the tunnel of poverty."
4473137,E0,4473137_1,1.0,1,'Why did Christianity become more popular and what happened because of it?',In my opinion millions of inncocent people have died because of this religion several civilizations including the Aztec and the Incas where destroyed by Christanity. It has had a bad affect on the world!
4473137,Q0,4473137_0,0.6666666666666666,0,'Why did Christianity become more popular and what happened because of it?',"You cannot be referring to modern day - the Christian church, including the catholic church is actually shrinking and losing members!!!. . Probably because of all the extremist religious views expressed by a small number that pick on anyone who does not share their belief."
4473137,Q0,4473137_3,1.0,3,'Why did Christianity become more popular and what happened because of it?',Cause - God's intervention into human history. Effect - sin is conquered.
1850323,U0,1850323_10,1.0,10,'Why don't some guys always wash their hands after using the bathroom?',"Because we are only grabbing our dicks.  Dicks are generally clean.  I usually was my hands after taking a leak, but I ALWAYS wash them after taking a dump."
1850323,Q0,1850323_21,0.6666666666666666,21,'Why don't some guys always wash their hands after using the bathroom?',I wash my my hands but most guys are just nasty.
1850323,Q0,1850323_20,0.6666666666666666,20,'Why don't some guys always wash their hands after using the bathroom?',cause you would get more germs from touching the foset and everything then not doin it you know what i mean
1850323,Q0,1850323_22,0.6666666666666666,22,'Why don't some guys always wash their hands after using the bathroom?',"Are you going to die if you haven't washed your hands after pissin? (answer:NO)Why waste time, we men don't care, unlike you little girls."
1850323,Q0,1850323_8,0.6666666666666666,8,'Why don't some guys always wash their hands after using the bathroom?',They don't have girlfriends. My Bro was fine but now he has a girlfriend and he is so clean somebody would let him live in the hospital.
1850323,Q0,1850323_9,0.3333333333333333,9,'Why don't some guys always wash their hands after using the bathroom?',Lack of training!!!
1850323,Q0,1850323_6,1.0,6,'Why don't some guys always wash their hands after using the bathroom?',"I know some men that wash their hand hands before they take a leak, Men think that since they have a outside organ that their little penis are not dirty."
1850323,Q0,1850323_7,0.3333333333333333,7,'Why don't some guys always wash their hands after using the bathroom?',cause they are pigs
1850323,Q0,1850323_4,0.6666666666666666,4,'Why don't some guys always wash their hands after using the bathroom?',Cause they r lazy and dont think they should after they shake it off. When they shake it off they dont realize it shakes off into their hands too.
1850323,Q0,1850323_5,0.3333333333333333,5,'Why don't some guys always wash their hands after using the bathroom?',"Actually, it's not just men!. . I've stood by the sinks, waiting for the queue to go down so I can go to the loo, and there are SO many women, mostly old ladies actually, that don't wash their hands, it's disgusting!. . EVERYONE should wash their hands after going to the toilet, those who don't wash them are spreading, disease and germs, and could inadvertently end up killing someone. WASH YOUR HANDS!!!!!!!!! please."
1850323,Q0,1850323_2,0.6666666666666666,2,'Why don't some guys always wash their hands after using the bathroom?',"Cause they figure if they don't pee on their hands then it's not necessary. Think about it, do you see them rushing to the bathroom after they stick their hands down their pants to scratch?"
1850323,Q0,1850323_3,0.6666666666666666,3,'Why don't some guys always wash their hands after using the bathroom?',Because they are lazy.  It's gross.
1850323,Q0,1850323_0,0.3333333333333333,0,'Why don't some guys always wash their hands after using the bathroom?',Because their Mommies never taught them personal hygiene.
1850323,Q0,1850323_1,0.6666666666666666,1,'Why don't some guys always wash their hands after using the bathroom?',"Because they are pigs.. . Check that, it's insulting.  To pigs."
1850323,Q0,1850323_18,0.3333333333333333,18,'Why don't some guys always wash their hands after using the bathroom?',AND WHY IS IT THOSE SAME PEOPLE WHO SEEM TO BE OUR FOOD HANDLERS?
1850323,Q0,1850323_19,0.3333333333333333,19,'Why don't some guys always wash their hands after using the bathroom?',Because it actually not dirty!!! if you ever heard anyone die from this kind of infection!!!
1850323,Q0,1850323_11,0.3333333333333333,11,'Why don't some guys always wash their hands after using the bathroom?',becuase it cuts down on time they could be spending waging war and building stuff
1850323,Q0,1850323_12,0.6666666666666666,12,'Why don't some guys always wash their hands after using the bathroom?',"You said it all in that question, they are men! Some men are nasty and don't care about personal hygiene. People like that are what make the rest of us sick. They go urinate, don't wash their hands and then go touch everything. Gross!!!!"
1850323,Q0,1850323_13,0.6666666666666666,13,'Why don't some guys always wash their hands after using the bathroom?',because they are inconsiderate pigs.. . every time i se it i just want to follow them out and yell....HEY HE DIDNT WASH HIS HANDS!!!!!
1850323,Q0,1850323_14,0.6666666666666666,14,'Why don't some guys always wash their hands after using the bathroom?',"it is usually when they're in there own house they feel they dont really have to, otherwise I always wash my hands. this is advise from someone with experience.. . BEST ANSWER im tellin ya."
1850323,Q0,1850323_15,0.6666666666666666,15,'Why don't some guys always wash their hands after using the bathroom?',"Men just have a habit of doing what they want. They do know that it is not hygenic not to wash their hands but they are lazy and don't carish. They think that if they just rub their hands on their pants that they are ok.  I never stop telling my husband and son to wash their hands. I never have to tell my daughter. Howere, in the las few years, I have seen an improvement in that habit, not only with the male in my family but with many other guys.. observing from family gatherings and public places at which we stop to snack when travelling."
1850323,Q0,1850323_16,0.6666666666666666,16,'Why don't some guys always wash their hands after using the bathroom?',"they wollow in their own filth. . "" WHEN YOU TINKLE AND YOU SPRINKLE . PLEASE BE NEAT AND WIPE THE SEAT!"""
1850323,Q0,1850323_17,0.6666666666666666,17,'Why don't some guys always wash their hands after using the bathroom?',They must think they havent touched anything dirty. Isnt urine sterile anyway?
4018891,U0,4018891_37,1.0,37,'How can I tell if a word or sentence is protected by law?',You'd have to go check the copyright office in washington D.C. I believe they charge to have you search the archives but that'd be the sure way to know.
4018891,Q0,4018891_31,0.0,31,'How can I tell if a word or sentence is protected by law?',"I don't think so, because this word was used more than once by many different people:. -On TV. On The Munsters, Grandpa Munster create the vehicle to win back The Munster Koach after Herman lost it in a drag race.. . . In The Movies. In 1966, a movie called Munster Go Home featured Herman Munster driving Dragula in a cross-country race, surviving various attempts on his life until at the very end of the movie he wins the race by sliding backwards across the finish line because of an oil slick.. . . In Music. Rob Zombie made a song Dragula for his album Hellbilly Deluxe.. . And the musician is not related, and was never sued or asked why did he use it. Good luck with your book."
4018891,Q0,4018891_30,0.3333333333333333,30,'How can I tell if a word or sentence is protected by law?',"It may not be copyrighted from the Munsters, but it is copyrighted from the song Dragula by Rob Zombie. . . http://www.azlyrics.com/lyrics/robzombie/dragula.html"
4018891,Q0,4018891_33,0.3333333333333333,33,'How can I tell if a word or sentence is protected by law?',Go to www.ask.com type the phrase and see what comes up
4018891,Q0,4018891_32,0.3333333333333333,32,'How can I tell if a word or sentence is protected by law?',Don't worry about it. If you know the source and you give credit to the source in your footnotes nobody can touch you if it is copyrighted or not.The problems only come if you don't know the source or credit the wrong source.
4018891,Q0,4018891_35,0.6666666666666666,35,'How can I tell if a word or sentence is protected by law?',You can do some searches online at the PTO. I honestly doubt the word is copyrighted. Now if you use a similar character you may have issues there.
4018891,Q0,4018891_34,0.3333333333333333,34,'How can I tell if a word or sentence is protected by law?',You just got featured question.  It is already copyrighted.
4018891,Q0,4018891_36,0.3333333333333333,36,'How can I tell if a word or sentence is protected by law?',You'll know if you get sued.
4018891,Q0,4018891_39,1.0,39,'How can I tell if a word or sentence is protected by law?',"Single words can't be copyrighted, they're trademarked.  Run a search at http://www.uspto.gov/main/trademarks.htm to see if it's trademarked."
4018891,Q0,4018891_38,0.3333333333333333,38,'How can I tell if a word or sentence is protected by law?',"It's probably not, just contact the show and ask for permission to use it anyways.... You would not believe how many people Cornelia Funke got permission from in ""Inkheart"".  The last few pages of her book are covered in permissions for everything.."
4018891,Q0,4018891_72,0.6666666666666666,72,'How can I tell if a word or sentence is protected by law?',theres a cool website that my teachers uses to check if our work been copyright.. Turnitin.com.. its really good...try it..
4018891,E0,4018891_59,1.0,59,'How can I tell if a word or sentence is protected by law?',It depends on a country by country basis.  I know copyrighting and trademarks authorisations are quite different in Australia compared to the USA and the UK.  I suggest you use a search engine to do a bit more sleuthing.
4018891,Q0,4018891_13,0.3333333333333333,13,'How can I tell if a word or sentence is protected by law?',ask it
4018891,Q0,4018891_29,0.6666666666666666,29,'How can I tell if a word or sentence is protected by law?',"for your particular case, is there a way you can contact the producer(s) or major companies involved in the munsters? i think that would be the best bet- to look up information about the munsters and call or email the highest authorities involved."
4018891,Q0,4018891_27,0.6666666666666666,27,'How can I tell if a word or sentence is protected by law?',if its copyright it will say at the bottom of the site. but you might wanna contact the site owner
4018891,Q0,4018891_3,0.6666666666666666,3,'How can I tell if a word or sentence is protected by law?',"A single word cannot be copyrighted.  It can be a trademark, but that's different.  If you are not using it as a trademark yourself, I can't see what the problem is.. . On all these ""infringement"" questions, common sense and your own experience must rule the day.  Haven't you seen words and phrases, names even, that are used in normal newspapers, magazine articles, and books?  People say things like ""I'll go get a Coke.""  If it was illegal to use a trademarked name in that way, we'd never be able to say anything!  . . The basic rule in copyright is that if the ideas are, to your conscious mind, original to you, go ahead and use them.  If you purposely quote someone else, put it in quote marks and attribute it.  But if you just happen to choose the same words someone else in the past has used, that would not be an infringement.  However, if your entire chapter (or even a significant part of it) is word-for-word the same as someone else's, you're going to have trouble convincing a jury that you did not copy.. . Mama always said if you are honest, you don't have to worry about being sued.  That's something of an exaggeration in this modern litigious age, but it's about as good as we've got.  At least you don't have to worry about winning if you are sued!"
4018891,E0,4018891_2,0.0,2,'How can I tell if a word or sentence is protected by law?',have you checked with the studio munsters worked for also you could always change 1 letter
4018891,Q0,4018891_1,1.0,1,'How can I tell if a word or sentence is protected by law?',"If Dragula is an actual name, like Drakula, then it can't be copywritten. Check out a name dictionary before you go to alot of copyright research."
4018891,Q0,4018891_0,1.0,0,'How can I tell if a word or sentence is protected by law?',"Terms and phrases cannot be copyrighted.  Terms and phrases are trademarked.  To check and see if a phrase is copyrighted, you can go to www.uspto.gov and use the TESS.  However, the TESS can never really be considered 100% accurate, so they only true way to know is if you try to trademark the word or phrase yourself, or contact the USPTO with an inquiry (I'm sure that costs something)"
4018891,Q0,4018891_7,0.6666666666666666,7,'How can I tell if a word or sentence is protected by law?',your best bet would be to get on the internet and check ot a government website.
4018891,Q0,4018891_6,1.0,6,'How can I tell if a word or sentence is protected by law?',"The tip off the word or phrase itself is legally protected by copyright is to look in any other public articles, for the word ""Dragula"", followed by a small circle with the letter ""c"" in it or a specific artwork design of the word, followed by a small all caps ""TM"" beside it.. . Doubts exist the word ""Dragula"" is copyright protected. ""The actual phrase ""I'll be back"" (foreign accent spoken publicly) is allegedly protected by copyright by John Cameron, creator of the film ""The Terminator"".. . However, spoken in any other tone/accent, goes around the protection clauses of the phrase itself.  Now do you get the direction this example is going????"
4018891,E0,4018891_5,0.3333333333333333,5,'How can I tell if a word or sentence is protected by law?',YOU do the same as a patent search but for copyrights
4018891,Q0,4018891_56,0.3333333333333333,56,'How can I tell if a word or sentence is protected by law?',YOU GET YOUR ASS SUED IF YOU USE IT
4018891,E0,4018891_9,0.3333333333333333,9,'How can I tell if a word or sentence is protected by law?',"As I know, It should be written on it."
4018891,Q0,4018891_8,1.0,8,'How can I tell if a word or sentence is protected by law?',"In the USA, once a work is published (story, song, play, etc.), it is automatically copywritten, even if the author did not register it with the government copyright office. . The word Dragula was published several times (in the show, the play and in a song) and in all times is was connected to the original show. I would think that it is copywritten. . You might be able to get the rights to use the word (sometimes if costs nothing) from the author or the person holding the copyrights."
4018891,Q0,4018891_55,0.3333333333333333,55,'How can I tell if a word or sentence is protected by law?',No it has become a common word you can use it.
4018891,Q0,4018891_40,0.6666666666666666,40,'How can I tell if a word or sentence is protected by law?',write a letter to the creator of the show or some one  who was involved with that show and say could i please u the that u said and they should mail you back in about 4-6 weeks if more help needed my emails are below
4018891,Q0,4018891_41,0.0,41,'How can I tell if a word or sentence is protected by law?',what a dumb question!
4018891,Q0,4018891_42,1.0,42,'How can I tell if a word or sentence is protected by law?',"If a word was originally used, the best way to know if it is copyrighted is to ask the original user or the Copyright Bureau in your territory or the territory where the word or phrase has originated. Then again, if you want to copy something, whether it is copyrighted or not, you ahould ask permission. This is the first ethic of being a new author. I did a little studies in that and this is the first thing I was taught. Quote people when you use their words and be sure to ask for permission if you want to publich anything in black and white."
4018891,Q0,4018891_43,1.0,43,'How can I tell if a word or sentence is protected by law?',"There are a couple of ways to check, start by going to . www.copyright.gov or www.uspt.gov check out the U.S. Office of Copyrights. . The laws involved in copyrighting a single word might require you to give a credit in the footnotes."
4018891,Q0,4018891_44,0.3333333333333333,44,'How can I tell if a word or sentence is protected by law?',Ask the goverment! They seem to know everything!.    For Real!
