query_id,relevance_type,answer_id,relevance,answer_n,query_text,answer_text
1964316,U0,1964316_5,1.0,5,"'What are you talking about when you say ""weed""?'",Weed could mean the bad thing that grow in ur graden or back and front yard. Or it could mean the drug.
1964316,Q0,1964316_3,1.0,3,"'What are you talking about when you say ""weed""?'",marijuana. and lots of it :)
1964316,Q0,1964316_2,1.0,2,"'What are you talking about when you say ""weed""?'",It could mean. 1) weeds outside on the lawn. 2) the drug
1964316,Q0,1964316_0,1.0,0,"'What are you talking about when you say ""weed""?'",Its the slang for marijuana other slangs include. . http://en.wikipedia.org/wiki/List_of_marijuana_slang_terms
1964316,Q0,1964316_1,0.6666666666666666,1,"'What are you talking about when you say ""weed""?'",weed is marijuana a lovely little plant that you smoke (some eat or drink). it makes people happy
1964316,Q0,1964316_4,0.6666666666666666,4,"'What are you talking about when you say ""weed""?'","It a bad drug, called marijuana. Don't ever try it, its horrable, it will make you hungry and thirsty at the same time. It will make you forget things and make you think of crazy question's and idea's. It is also very addicting. The only thing worse would be alcohol!!"
2418598,U0,2418598_0,1.0,0,'Why do people have different levels of wisdom?',"a lot of studies have shown that overal brain size isnt as important as complexity and size of the outer layer of the brain, the crerebral cortex.. it is pretty much known that this part of the brain carries out the complex ""thought"" and ability to put things together that would eventually add up to be wisdom. another huge factor, probably more important, is live experience.. not just the top layer, obvious things, but the underlying developmental processes that every human goes through. there are tons of things that shape a persons mind, ability, level of conciousness, clarity, etc"
2418598,Q0,2418598_9,1.0,9,'Why do people have different levels of wisdom?',"life experiences shape wisdom, but more information grows the brain, plus some people just have big heads =)"
2418598,Q0,2418598_8,0.6666666666666666,8,'Why do people have different levels of wisdom?',"it is not HOW BIG your brain is (since size of human brain is almost the same), it is HOW MUCH you use it. . how we brought up and how we're educated means a lot in shaping a person's thinking. if someone is learning by SPOON-FEEDING him with knowledge, he only know what's being fed to him. if he was trained to think a lot and try a lot, the accumulation of his experiences will teach him to be wiser. . it is all about how often we EXERCISE our brains."
2418598,Q0,2418598_1,0.6666666666666666,1,'Why do people have different levels of wisdom?',experiance
2418598,Q0,2418598_3,1.0,3,'Why do people have different levels of wisdom?',"The morphology of the brain is mostly the same. But your preception, inteligence, memory, everything really are affected by the neuaral connections inside the brain. The connections form according to need and use and are uniqe to each individual: they depend on your personal expirience and so on."
2418598,Q0,2418598_2,0.6666666666666666,2,'Why do people have different levels of wisdom?',"Can we talk about IQ? Partially due to family genes i believe.. But mostly still depends on the environment and experience of the child.. This made me think about another question. Do u guys think that brain size do has effect on the itelligence? According to the record, Genius Einstein has a bigger brain size than normal people.."
2418598,Q0,2418598_5,0.6666666666666666,5,'Why do people have different levels of wisdom?',some people are wiser than others .
2418598,Q0,2418598_4,0.6666666666666666,4,'Why do people have different levels of wisdom?',"well, there was a big debate about that within the last year with the president of Harvard, but...I don't want to get into that.... . I think Sandra Cisneros said it best ""We are the Sum of Our Experiences"".  This is where I adapt my view from, our wisdom varies because of the things we have experienced."
2418598,E0,2418598_7,0.3333333333333333,7,'Why do people have different levels of wisdom?',"Knowledge is just accretion of data...Wisdom is more akin to intuition.... .   As you seem interested in the physiognomy of the brain-we are speaking more of the linking ""dendrites"" organized well and orchestrating...rather than the sheer volume of neurons.... .   Observe the brain activity of a symphony conductor leading a composition he has composed...he will be using more of his brain and more efficiently.... .   Yet there are more subtle levels such as ""body awareness""...not all thinking...and more precisely ""intuition"" is bound to the activity of the brain alone..."
2418598,Q0,2418598_6,0.6666666666666666,6,'Why do people have different levels of wisdom?',"education, enviroment, life experiences, who you hang around --- hang out with smart people and you will have more wisdom."
2418598,Q0,2418598_10,0.0,10,'Why do people have different levels of wisdom?',WHY DO YOU ASK SUCH NONSENSE!!!!!!!!!!!!!!!????????. . . o_o
1167882,U0,1167882_0,1.0,0,'What are the different kinds of bad things people do and why do they do them?',"Sin is the affect of an earlier problem.Sin occurs mainly after temptation has been acted upon by our spirit and body.Sin is something that if not repented of will lead to death not in the bodily sense alone but spiritual as well.""The second death"" as it is called is what punishment is aquired for the acummulation of unrepented sin.Actually if a person is baptized into Christ and has repented and living the Christian life as best they can there will still be sin.Thing is we then have the privledge to ask forgiveness of sins as long as we try not to sin which is what repent actually broken down means.To turn from sin.Sin actually is no worse than another sin for instance Christ only really spoke of one and that is blasphemy and it is the worst of all.Sexual sin is a biggy but only because when you are baptized into Christ's body then you have the holy spirit within you.So having sex you are involving the holy spirit which lives inside of you which is definetly not good.Sin for the most part is equal.For instance some so called christians say that homosexuality is worse than other sins but in reality if I looked upon a woman sexually it is no worse than if a man looks at another man that way or vice versa.Just remember that sin is an act not something we are born with as calvinists and catholics believe.A baby that cannot walk talk or have sex cannot sin!Therefore it doesnt need baptism as a baby as they say besides a baby cannot confess Christ as Lord nor repent of sins for it has none.Hope this helps"
1167882,E0,1167882_8,0.6666666666666666,8,'What are the different kinds of bad things people do and why do they do them?',"the only sin that will get you into hell, is rejecting Jesus Christ as your Lord and savior.. . All the other sins were dealt with at the cross, so you dont need to worry about them if youve accepted Jesus as Lord. Coz the bible, will show you how to overcome all other sin.. . but as a non believer, the wages of sin is eventually death, and eternal hell. Coz they havent repented of the only sin that needs to be dealt with for eternal life.. . its a long long story, ask God, read the word of God. you will find your answers"
1167882,Q0,1167882_6,0.3333333333333333,6,'What are the different kinds of bad things people do and why do they do them?',"the idea of sin is relative to what you think is right and wrong.  therefore, there is no such thing as sin."
1167882,E0,1167882_5,1.0,5,'What are the different kinds of bad things people do and why do they do them?',Sorry. but SIN does not exist.. so there are no difference between one kind of a thing That Does Not Exist and another thing That Does Not Exist
1167882,Q0,1167882_4,0.6666666666666666,4,'What are the different kinds of bad things people do and why do they do them?',"Well there is the seven deadly sins...Murder, Lust, Greed, Gluttony, Stealing, Lying, and Christianity...The last three go together as Christianity is based on lies, and stealing,(in as much as the rituals and holidays they use were in practice BEFORE the birth of Christ)."
1167882,Q0,1167882_3,1.0,3,'What are the different kinds of bad things people do and why do they do them?',"SIN is not believing the words of the Bible are true, also called unbelief. And sins are what mankind does because we do not believe the Bibles. 1 Corinthians 5:11 But now I have written unto you not to keep company, if any man that is called a brother be a fornicator, or covetous, or an idolater, or a railer, or a drunkard, or an extortioner; with such an one no not to eat. Mark 10:19 Thou knowest the commandments, Do not commit adultery, Do not kill, Do not steal, Do not bear false witness, Defraud not, Honour thy father and mother. Romans 13:9 For this, Thou shalt not commit adultery, Thou shalt not kill, Thou shalt not steal, Thou shalt not bear false witness, Thou shalt not covet; and if there be any other commandment, it is briefly comprehended in this saying, namely, Thou shalt love thy neighbour as thyself.Galatians 5:19 Now the works of the flesh are manifest, which are these; Adultery, fornication, uncleanness, lasciviousness,20 Idolatry, witchcraft, hatred, variance, emulations, wrath, strife, seditions, heresies,21 Envyings, murders, drunkenness, revellings, and such like: of the which I tell you before, as I have also told you in time past, that they which do such things shall not inherit the kingdom of God..  . This is by no means a complete list but all of these are sins, but all a Christian has to do is ask for forgiveness, believe you are forgiven and realize this was why Jesus Christ had to die, for your unbelief in God's word. Realizing you are a sinner by nature, you do not become discouraged by your failing."
1167882,Q0,1167882_2,0.3333333333333333,2,'What are the different kinds of bad things people do and why do they do them?',"Sins are caused by demons, don't you know?. . . . . . . . . lol, I don't believe in the existence of god."
1167882,Q0,1167882_7,0.0,7,'What are the different kinds of bad things people do and why do they do them?',GOOGLLEEEEEEEEEEEEEEEEEEEEEEEEEEEEEEEEEEEEEEEEEEEEEEEEEEEEEEEEEEEEEEEEEEEEEEEEEEEEEEEEEEEEEEEEEEEEEEEEEEEEEEEEEEEEEEEEEEEEEEEEEEEEEEEEEEEEEEEEEEEEEEEE
1167882,Q0,1167882_1,0.6666666666666666,1,'What are the different kinds of bad things people do and why do they do them?',"There's bad sin and really bad sin(abomination).  Rev 21:27. Luke 16:15, Lev.7:18.. I Corinthians 13:;8a, Love never fails."
1880028,U0,1880028_3,1.0,3,"'What does ""see Leaflet"" mean on the Ept Pregnancy test?'","It means the leaflet that should be enclosed in the box. If you can't find the leaflet, check out the link below."
1880028,Q0,1880028_2,0.3333333333333333,2,"'What does ""see Leaflet"" mean on the Ept Pregnancy test?'",you didn't get a leaf in yours?
1880028,Q0,1880028_1,0.0,1,"'What does ""see Leaflet"" mean on the Ept Pregnancy test?'",You stuck it in the wrong hole.
1880028,E0,1880028_0,1.0,0,"'What does ""see Leaflet"" mean on the Ept Pregnancy test?'",Leaflet is the info inside the package with the test.
1880028,Q0,1880028_4,1.0,4,"'What does ""see Leaflet"" mean on the Ept Pregnancy test?'",It just simply means read the directions that are inclosed with the test if you have any questions.
2192891,U0,2192891_7,1.0,7,'How do orthodontists put braces on and do they hurt a lot?',"Dental cement, it hurts some but it's not like you got stabbed, it's kind of like a dull ache when the wires get tightened... It's not excruciating and it's totally worth it when it's over.  After you're teeth have been corrected they take pliers and just pop the braces off and sand down the connection point - sounds kind of barbaric but it's not really that bad... just think about having a beautiful straight smile for the rest of your life!"
2192891,Q0,2192891_3,0.6666666666666666,3,'How do orthodontists put braces on and do they hurt a lot?',They cement the to your teeth and yes it does hurt!!!! . Believe me i had mine on for 3 yrs just got the off though GGOOD LUCK!
2192891,Q0,2192891_1,0.6666666666666666,1,'How do orthodontists put braces on and do they hurt a lot?',"just got braces a couple months ago. As for how they get put on, I'm not 100% sure, but the spread your lips really far apart, and put this kinda weird stuff *you can't feel it* and stick the brackets on that *in case you don't know what brackets are, their almost box things that keep the wires on* they but some weird blue UV light over it for a long time *your lips get reaaaaly sore* and that solidifies the braces on. They then stick the wire in and close the brackets *at least on mine* As for if they hurt, my orthodontist said you could be sore for a couple days,but I wasn't. And you get used to them faster than you think they will.. . Don't be afraid!!!!. . P.S. These people who say it hurts a ton, or are really uncomfortable are lying!!!!"
2192891,Q0,2192891_2,0.6666666666666666,2,'How do orthodontists put braces on and do they hurt a lot?',"Yupp, before you go in, were LOTS of chapstick, they take this see-through thing, puts it in your mouth, it spreads your mouth WIDE OPEN, it feels like your jaws gonna break off!!! And they dry out your mouth COMPLETLY! and then they glue them on! PROCESS TAKES AT LEAST 2HRS"
2192891,Q0,2192891_0,1.0,0,'How do orthodontists put braces on and do they hurt a lot?',"The brackets can be glued or cemented on, it's uncomfortable getting them and they hurt a lot adjusting to them for the first few days and when they are tightened but you get used to them so quickly it actually feel funny when they are off.  Plus you get to have a great straight smile : )"
2192891,Q0,2192891_10,1.0,10,'How do orthodontists put braces on and do they hurt a lot?',"I had braces for three years. It was about 10 yrs ago and they used medical grade cement, little drops to adhere the metal to your teeth. I don't remember if it hurt to have them put on, but the monthly adjustments felt like I was teething. It was kind of an anxious feeling. I had 4 teeth pulled prior to getting them on, headgear as a child, an extra year of braces due to moving out of state and TONS of ""cranking."" I would do it all over though because I used to never smile, and since then I get compliments all the time... . My point: You'll be ok. A smile is one of the best gifts you can give someone. It doesn't hurt that bad, but the whole time you know you have a cool day to look forward to."
2192891,Q0,2192891_11,0.3333333333333333,11,'How do orthodontists put braces on and do they hurt a lot?',the expander is the wrost.
2192891,Q0,2192891_4,0.6666666666666666,4,'How do orthodontists put braces on and do they hurt a lot?',"The brackets are cemented to your teeth. That doesn't hurt, but the wires do. It's worth it though."
2192891,Q0,2192891_5,1.0,5,'How do orthodontists put braces on and do they hurt a lot?',"They use a cement-like glue and put all the brackets on, then insert the wires. It did not hurt me getting them on, but my teeth were very sore and sensitive for about two or three days afterwards. The chains -- you'll probably get them later -- really hurt the first time too. I just got mine off, and that doesn't hurt either.. . Good luck... :)"
2192891,Q0,2192891_6,1.0,6,'How do orthodontists put braces on and do they hurt a lot?',"I had braces for three years, and they didn't hurt.  Your teeth are shifting and sometimes that can cause headaches, but ""hurt"" is a strong word.  You will feel minor discomfort when they get tighten, but nothing too serious.  In fact, swolling a aspirn or taking a tylenol will help you, if you are uncomfortable. By the way, once you get your braces off, you will feel good about the entire process.  Your smile is worth it."
2192891,Q0,2192891_8,0.6666666666666666,8,'How do orthodontists put braces on and do they hurt a lot?',"they are not that bad once you have them on. it takes a while, they have to cement them to your teeth, with brackets, wires. stuff also gets caught in them too. but you will like the outcome of you nice teeth. some of the wires can bug you and you have to take really good care of your teeth with them."
2192891,E0,2192891_9,0.6666666666666666,9,'How do orthodontists put braces on and do they hurt a lot?',i don't think they differ. . . I had them for a year. They have like a container (made for your teeth) and they put glue on your teeth first to make them stay and then they push the container up and the braces are one they use a light to have the glue dry faster then they make the wire and they cut to fit your mouth and if something hurts just tell the orthodontist
949154,U0,949154_6,1.0,6,'who is a butler?',"The butler is a senior servant in a large household. Usually the butler is the most senior staff member, although in the great houses of the past, the household was sometimes divided into departments with the butler in charge of the dining room (including the wine cellar) and pantry, and sometimes the entire parlour floor, and a housekeeper who was in charge of the whole house and its appearance. Housekeepers are occasionally portrayed in literature as being the most senior staff member and as even making recommendations for the hiring of the butler."
949154,Q0,949154_3,0.6666666666666666,3,'who is a butler?',a rich person's slave.
949154,E0,949154_2,0.0,2,'who is a butler?',whatever you want him to do...!
949154,Q0,949154_1,1.0,1,'who is a butler?',"A (usually) male servant who performs various household duties for wealthy people, including answering the telephone, answering the door, overseeing other servants, and being in charge of organizing dinners, etc."
949154,Q0,949154_0,1.0,0,'who is a butler?',"a butler usually is a male waiter u appoint at your house to look after the housekeeping.he is the one who usually answers the door , phone etc.he also sees to the overall hosekeeping."
949154,Q0,949154_7,0.6666666666666666,7,'who is a butler?',"Basically, a male maid."
949154,E0,949154_5,0.3333333333333333,5,'who is a butler?',"someone who waits on you hand and foot.. Thanks jeeves for answering that for me.. Your very welcome master, will there be anything else?. no jeeves, you are dismissed."
949154,Q0,949154_4,0.6666666666666666,4,'who is a butler?',Its a maid. Just that its a male one. HAHA!
949154,Q0,949154_9,0.6666666666666666,9,'who is a butler?',"Housekeeper. More responsibilites than a maid, in fact, if the house has a maid the butler would be their boss."
949154,Q0,949154_8,0.6666666666666666,8,'who is a butler?',a male maid.  a man who does chores around the house
949154,Q0,949154_16,1.0,16,'who is a butler?',"The butler is a senior servant in a large household. Usually the butler is the most senior staff member, although in the great houses of the past, the household was sometimes divided into departments with the butler in charge of the dining room (including the wine cellar) and pantry, and sometimes the entire parlour floor, and a housekeeper who was in charge of the whole house and its appearance. In this case the butler may have been either subordinate or equal to the housekeeper. .... . In the Madras and Bombay Presidencies this is the title usually applied to the head-servant of any English or quasi-English household. He generally makes the daily market, has charge of domestic stores, and superintends the table. As his profession is one which affords a large scope for feathering a nest at the expense of a foreign master, it is often followed at Madras by men of comparatively good caste."
949154,Q0,949154_15,0.6666666666666666,15,'who is a butler?',"Basically a male maid. They answer the door, cook, clean, etc."
949154,Q0,949154_14,1.0,14,'who is a butler?',"--------------------------------------------------------------------. a butler is like having a hotel manager for your home.. . he is there to make sure that the insurance salesman does not get through the door (and will never call again). your friend who got drunk at the party goes home in a taxi instead of driving. Will be ready with a scotch-and-water when you need one but make sure you don't have three when you have a business meeting later on. A source of wisdom, calm, discrete. Handles any problem before it becomes a catastrophe. Also see PG Woodhouse ""Jeeves"" stories"
949154,Q0,949154_13,1.0,13,'who is a butler?',"servant,head servant, house boy, man, manservant, steward, valet"
949154,Q0,949154_12,0.6666666666666666,12,'who is a butler?',a butler is a maid whom is man. like alfred can i have best answer peas
949154,Q0,949154_11,0.3333333333333333,11,'who is a butler?',buttler is a maid.
949154,Q0,949154_10,1.0,10,'who is a butler?',"The butler is a senior servant in a large household. Usually the butler is the most senior staff member, although in the great houses of the past, the household was sometimes divided into departments with the butler in charge of the dining room (including the wine cellar) and pantry, and sometimes the entire parlour floor, and a housekeeper who was in charge of the whole house and its appearance. Housekeepers are occasionally portrayed in literature as being the most senior staff member and as even making recommendations for the hiring of the butler.. . In modern houses where the butler is the most senior worker, titles such as Majordomo, Butler Administrator, Staff Manager, Estate Manager and Head of Household Staff are sometimes given.. . The word ""butler"" derives from the Old French ""bouteillier"", (meaning ""cup bearer""), from ""bouteille"", (""bottle""). The role of the butler, for centuries, has been that of the chief steward of a household, the attendant entrusted with the care and serving of wine and other bottled beverages (which in ancient times represented a considerable portion of the household's assets.). . In Britain the butler was originally a middle ranking member of the staff of a grand household. In the 17th and 18th centuries the butler gradually became the usually senior male member of a household's staff (in the very grandest households there was sometimes a house steward senior to the butler into the 19th century). Butlers used to always be attired in a special uniform, distinct from the livery of junior servants, but today a butler is more likely to wear a business suit or business casual clothing and appear in uniform only on special occasions.. . The earliest literary mention of a butler is probably that of the man whose release from prison was predicted by Joseph in the biblical account of Joseph's interpretation of the dreams of the Pharaoh's servants.. . In London there remains only one hotel which offers a private butler service, The Lanesborough Hotel."
1844896,U0,1844896_0,1.0,0,'How to make beef burgers?',"You could get a meat thermonmeter and pull the burgers off when they hit about 145 to 150 degrees F in the center.  (The time depends on how thick the burger is.)  Then you put them in a foil pouch to let them rest and let the juices re-distrubute for 5 to 7 minutes.  The temperture should increase by about 5 degrees while they rest, so food illness is decreased."
1844896,Q0,1844896_4,0.6666666666666666,4,'How to make beef burgers?',"I usually cook burgers until they quit bleeding on both sides, then maybe just a little longer. The cooking time will vary depending on the thickness of the burger."
1844896,Q0,1844896_1,1.0,1,'How to make beef burgers?',"Angus is just a type of ground beef.  They cook the same way as hamburgers.  I would say maybe you don't want to cook them all the way through, but if you do, cook until the juices run clear.  I would say maybe about 4 mins on each side.  Make sure your flame is low, you don't want to char the outside of them before the inside is done.  And watch for flareups, if you cook until the fat runs out, it will flare up and give an off flavor to the burger.  Lastly, you could purchase a food thermometer...140 degrees for medium, and 165 for well done.  Good luck, and email me with any questions!. . OH YEAH!  One more thing...you don't have to make a 'test' burger, you could always just crack it open a little to see the inside, and then serve crack side down on the bun!"
1844896,Q0,1844896_2,0.3333333333333333,2,'How to make beef burgers?',"Angus is just hamburger, there's nothing special about it."
1844896,Q0,1844896_3,0.6666666666666666,3,'How to make beef burgers?',"If cooking on the bar-b-q cook on one side until blood appears, turn over wait until juices run clear. Do not keep turning."
3723508,Q0,3723508_3,0.6666666666666666,3,How are oxen and bulls different?,im not sure what the difference is  other than the difference between a houstine and a angus but just because a bull is castrated doesnt make him an ox it just makes him a steer
2634143,U0,2634143_1,1.0,1,"'What is borrowing, when it happens, and why does it happen?'",linguistic borrowing i think means that people from one country borrow some expressions or words from another country. Not neccesarely countries it could happen inside one.
2634143,Q0,2634143_0,0.0,0,"'What is borrowing, when it happens, and why does it happen?'",not being onesself
2382487,U0,2382487_19,1.0,19,'What should I do if I haven't started my period in about 6 months?',"Go to the doctor. unless you are too young to have established a regular cycle, then dont worry too much, but still, you should have a chat with your family doctor."
2382487,Q0,2382487_18,1.0,18,'What should I do if I haven't started my period in about 6 months?',A lot of women have that problem. But I would still go see your doctor.
2382487,Q0,2382487_10,0.6666666666666666,10,'What should I do if I haven't started my period in about 6 months?',see a Dr. if your not preg. you could just be stressed
