query_id,relevance_type,answer_id,relevance,answer_n,query_text,answer_text
2018562,Q0,2018562_10,0.3333333333333333,10,'Why does my dog howl to a song about police?',"He watches the show too much. Every so often, I do the same thing."
2018562,Q0,2018562_11,0.6666666666666666,11,'Why does my dog howl to a song about police?',Your dog is just plan out weird! It could be a reincarnation of someone that was murdered in a certain way that they show on law in order and justice wasn't served! and sorry if i didn't spell correctly!
2018562,E0,2018562_3,0.6666666666666666,3,'Why does my dog howl to a song about police?',"I don't have any idea how that song goes, but maybe he associates the song with siren sounds. Dogs have very sensitive ears, as you know. A siren sound literally hurts their ears, because they are very sensitive to sounds. A lot of dogs start howling whenever they hear it, because it's a very high-pitched sound."
2018562,Q0,2018562_1,0.6666666666666666,1,'Why does my dog howl to a song about police?',"Some dogs howl habitually at noises that are unusual to them.  My black lab used to howl at police sirens - not fire trucks, mind you, just police sirens.  Other than that, he was quiet as a mouse. Even coyotes howling couldn't get him started. . . One expert says, if your dog howls during music, he's just sining along, showing he's part of the ""pack""."
2018562,Q0,2018562_6,0.3333333333333333,6,'Why does my dog howl to a song about police?',"You should do a science project with him.  Play him the theme songs from these shows:  . . NYPD Blue. L.A. Law. Hunter. The Commish. NewsRadio. Blossom. Hill Street Blues. The A-Team. The Greatest American Hero. Magnum, P.I.. Doogie Howser, M.D.. Quantum Leap. Remington Steele. Renegade. Silk Stalkings. Wise Guy. . See how he reacts to each of theme.  Perhaps he's just really into the musical compositions of Mike Post."
2018562,Q0,2018562_7,0.6666666666666666,7,'Why does my dog howl to a song about police?',"Isn't there a siren in there somewhere, maybe towards the end.  Maybe she howls first before the other dogs, or what she thinks are dogs,  at the end."
2018562,E0,2018562_4,1.0,4,'Why does my dog howl to a song about police?',"Because it is the only way he can release the inevitable tension caused by the ""dum dum""s as the show progresses.. . Come on, you know we're all on the edge of our seats everytime we hear that sound. You're dog is just a huge fan. :)"
2018562,Q0,2018562_5,0.6666666666666666,5,'Why does my dog howl to a song about police?',Either he likes the sound or it's hurting his ears.
2018562,Q0,2018562_0,0.3333333333333333,0,'Why does my dog howl to a song about police?',He wants to be a police dog.!
2018562,Q0,2018562_8,0.3333333333333333,8,'Why does my dog howl to a song about police?',"My cocker spaniel did this too, to the opening theme song to The Young and the Restless when I was growing up. It was only the intro song, but not the closing theme song, which sounded the same to me. Are we being warned by our faithful pets of subliminals?"
2018562,Q0,2018562_9,0.6666666666666666,9,'Why does my dog howl to a song about police?',he's intrigued by the show. & loves Detective Briscoe. & not ice t.
1477322,U0,1477322_7,1.0,7,'Why do some people think Germans are mean to others?',the roots of the nazi party would be a reason. I've never heard of this though.
1477322,E0,1477322_0,1.0,0,'Why do some people think Germans are mean to others?',"Because most people who have those view are most closet racists.They like to pick on Germans because they think it's alright to,but it's not. They need to get over what is now history and concentrate on what is happening in the world today.I love Germans."
1477322,Q0,1477322_1,0.6666666666666666,1,'Why do some people think Germans are mean to others?',"The fact that your young men went backpacking across Europe in the late 30s and early 40s trying to snuff out those not fit to live with the ""Master Race"" will probably have to still take a couple more centuries to fade from Human memory."
1477322,Q0,1477322_2,0.6666666666666666,2,'Why do some people think Germans are mean to others?',maybe its because the nazis were german i guess
1477322,Q0,1477322_4,0.6666666666666666,4,'Why do some people think Germans are mean to others?',"because of way back when...Hitler was in charge.  this is so stereotyping and not cool.  Even if they were, so are others in their own way."
1477322,Q0,1477322_5,0.0,5,'Why do some people think Germans are mean to others?',because the apple doesen't fall far from the tree.
1477322,Q0,1477322_6,0.6666666666666666,6,'Why do some people think Germans are mean to others?',"They got that Hitler and the Nazi's crap hanging over their heads. Their all being profiled for the actions of past German men who were in positions of power over their country, who committed vile and unforgivable acts for the sake of their own personal agendas. It's a damn shame German folks today have to be associated with that. Kinda like the myth of Adam and Eve, and we humans today have to  have sin hanging over heads, for something THEY did."
1477322,Q0,1477322_3,0.3333333333333333,3,'Why do some people think Germans are mean to others?',The Nazi's gave Germans and Aryans a bad name
2180086,U0,2180086_0,1.0,0,'What are men?',"For other uses, see Mormon (disambiguation).. Mormon is a colloquial term used to refer to adherents of the Latter Day Saint movement, and most commonly to the movement's original and largest group, The Church of Jesus Christ of Latter-day Saints. The term is derived from The Book of Mormon, which Joseph Smith claims to have translated from ancient plates containing a history of the early inhabitants of the Americas that was compiled by a prophet called Mormon. Some mainstream Christian groups consider Mormonism as a cult."
2180086,Q0,2180086_12,1.0,12,'What are men?',Mormons are members of The Church of Jesus Christ of Latter-Day Saints.
2180086,Q0,2180086_11,1.0,11,'What are men?',"References: Mormon vs Biblical Teachings about Salvation . . . Bible quotations are from the New American Standard version. For information on sources of Mormon quotations, see the section titled ""Mormon Documents"".. . . . 1. Mormons teach that salvation (exaltation) comes through faith in Christ plus baptism plus works, i.e., we must add to the work of Christ. In the Bible 'salvation' means deliverance from the consequence (eternal separation from God) of our sin. Mormon leaders have redefined the word 'salvation' to have a two-fold meaning: a) forgiveness of sins and b) universal resurrection:. . ""There will be a General Salvation for all in the sense in which that term is generally used, but salvation, meaning resurrection, is not exaltation"" (Stephen L. Richards, Contributions of Joseph Smith, LDS tract, p.5). . ""All men are saved by grace alone without any act on their part, meaning they are resurrected"" (Bruce McConkie, What Mormons Think of Christ"", LDS tract, p.28). . Thus, when a Mormon speaks of 'salvation by grace', he is usually referring to universal resurrection. Mormons use the term 'exaltation' to refer to attain a place in the highest level of heaven. The Mormon term 'exaltation' is more nearly equivalent to the Biblical term 'salvation'. What do Mormon leaders say about this?. . The Book of Mormon says of salvation: ""for we know that is is by grace that we are saved, after all that we can do"" (Book of Mormon, 2 Nephi 25:23). . The LDS Third Article of Faith states: ""We believe that through the Atonement of Christ, all mankind may be saved, by obedience to the laws and ordinances of the gospel"" (Pearl of Great Price: Articles of Faith). . Joseph Fielding Smith explains what that last phrase means: ""that which man merits through his own acts through life and by obedience to the laws and ordinances of the gospel"" (Doctrines of Salvation, vol. 1, p.134). . James Talmage explains: ""...redemption from personal sins can only be obtained through obedience to the requirement of the Gospel, and a life of good works"" (James Talmage, in A Study of the Articles of Faith). . Spencer W. Kimball states: ""however powerful the saving grace of Christ, it brings exaltation to no man who does not comply with the works of the gospel"" (The Miracle of Forgiveness, pg. 207); ""Each command we obey sends us another rung up the ladder to perfected manhood and toward godhood; and every law disobeyed is a sliding toward the bottom where man merges into the brute world"" (Teachings of Spencer W. Kimball, pg. 153); ""living all the commandments guarantees total forgiveness of sins and assures one of exaltation...trying is not sufficient. Nor is repentence when one merely tries to abandon sin"" (The Miracle of Forgiveness, p.164-165, 354-355). . Bruce McConkie claimed: ""Jesus kept the commandments of his Father and thereby worked out his own salvation, and also set an example as to the way and the means whereby all men may be saved"" (The Mortal Messiah, Vol.4, p.434). . What works do they mean? Here are some:. . Baptism for the dead: ""The greatest responsibility in this world that God has laid upon us is to seek after our dead...Those saints who neglect it in behalf of their deceased relatives, do it at peril of their own salvation"" (Joseph Smith, in Teachings of the Prophet Joseph Smith, p.356, 196). . Marriages sealed in the Temple: ""Marriage is not only a righteous institution, but obedience to this law [Temple marriage] is absolutely necessary in order to obtain the highest exaltation in the Kingdom of God"" (Milton R. Hunter, in Gospel Through the Ages, p.119). . Keeping the whole law: ""To enter the celestial [kingdom] and obtain exaltation, it is necessary that the whole law be kept...Do you desire to enter the celestial Kingdom and receive eternal life? "
2180086,Q0,2180086_10,0.6666666666666666,10,'What are men?',Its a religious group
2180086,Q0,2180086_9,1.0,9,'What are men?',Mormons are members of the Church of Jesus Christ of Latter-Day Saints.
2180086,Q0,2180086_8,0.3333333333333333,8,'What are men?',"Less women?  I'm sorry, I just couldn't pass that up - go encyclopedia.com and they have a good rendering of the Latter  Day Saints aka Mormans."
2180086,Q0,2180086_3,0.3333333333333333,3,'What are men?',"When the religion started, there were probably more-men ,than women  hence the name MORMEN"
2180086,Q0,2180086_2,1.0,2,'What are men?',"Mormons are Christians who also believe the original church of Christ, as dictated in the New Testament, has been restored.  The Church of Jesus Christ of Latter-Day Saints is led by actual revelation from God, and his authority has been given to us to perform ordinances such as baptism."
2180086,E0,2180086_1,1.0,1,'What are men?',They are believers in Jesus Christ and believe he came to ancient tribes on this continent after the Resurrection.   they believe that this life is about progression of the soul.It is Mormon
2180086,Q0,2180086_7,0.3333333333333333,7,'What are men?',there stupid inconsiderate muderers. look up mountain meadows massacre. youll find all you need to know
2180086,Q0,2180086_6,0.0,6,'What are men?',Another word for Stoopid
2180086,Q0,2180086_5,1.0,5,'What are men?',"Mormons are members of a religion that is close to Christianity.  Instead of taking its roots only from the Bible, it bases much of its belief from its founder, who supposedly found the Book of Mormon.. . Here's a good page with basic info on Mormons."
2180086,Q0,2180086_4,1.0,4,'What are men?',offshoots of the Christian faith founded by Joseph Smith in 1830. he writes an addition to the Bible called the book of mormom. he thinks Jesus will come back when he turns 85 in 1890 he dies in 1844 because of mob murder. their also called Latter day saints.
3723508,U0,3723508_0,1.0,0,How are oxen and bulls different?,Oxen are castrated and easier to train they are smarter and used for labor. Bulls are not castrated and really aggressive un-trainable..
3723508,Q0,3723508_3,0.3333333333333333,3,How are oxen and bulls different?,im not sure what the difference is  other than the difference between a houstine and a angus but just because a bull is castrated doesnt make him an ox it just makes him a steer
3723508,Q0,3723508_1,0.3333333333333333,1,How are oxen and bulls different?,a bull is colour blind while a ox is not colour blind
3723508,Q0,3723508_2,0.3333333333333333,2,How are oxen and bulls different?,ox it's norvegin bull
474417,U0,474417_5,1.0,5,"'What does the word ""cycle"" mean in stories about Greek gods and goddesses?'","The English prefix ""cyclo-"" comes from the Greek ""kyklo-"" which basically means ""circle, ring, round.""  Thus, ""Cyclops (Kyklops)"" just means ""Round eye."""
474417,Q0,474417_6,0.6666666666666666,6,"'What does the word ""cycle"" mean in stories about Greek gods and goddesses?'","i think it's ""wheel."""
474417,E0,474417_7,1.0,7,"'What does the word ""cycle"" mean in stories about Greek gods and goddesses?'",circle
474417,Q0,474417_4,0.6666666666666666,4,"'What does the word ""cycle"" mean in stories about Greek gods and goddesses?'","Cyclo comes from ""Cyclops"" in Greek mythology."
474417,Q0,474417_3,1.0,3,"'What does the word ""cycle"" mean in stories about Greek gods and goddesses?'",Cyclo means wheel or  circle
474417,Q0,474417_0,0.0,0,"'What does the word ""cycle"" mean in stories about Greek gods and goddesses?'",tmarquis77 is right.
474417,Q0,474417_1,0.0,1,"'What does the word ""cycle"" mean in stories about Greek gods and goddesses?'",A term used in Cambodia and Vietnam for a cycle rickshaw. The 1995 Vietnamese film Cyclo
474417,Q0,474417_2,0.6666666666666666,2,"'What does the word ""cycle"" mean in stories about Greek gods and goddesses?'","I would think it would mean ""one"" like a cyclops?"
849221,U0,849221_13,1.0,13,'Why don't people understand that history often repeats itself?',"You mean like you and all your ""questions"" regarding religion.  You repeat and repeat the same stuff.  Most people aren't closed minded and stubborn ...I think they are just tired of hearing the same old stuff from you."
849221,Q0,849221_9,0.3333333333333333,9,'Why don't people understand that history often repeats itself?',"I think FIGHTING for RELIGION is like ""Balling for Virginity"".. . Nuff' Said."
849221,Q0,849221_8,0.6666666666666666,8,'Why don't people understand that history often repeats itself?',"That's a pretty broad brush you're painting with, Kero. It's really unfair and incorrect to suggest that all of the monotheistic faiths have ""caused nothing but harm to everyone in and around it."". . A small example: You probably could kiss modern science goodbye as you know it, if it wasn't for the Christians who believed God had placed intrinsic order in the universe that they could discover. Many of the major scientists 200-300 years ago that started the ball rolling believed in God.. . And many of the men who founded the United States were also firm believers. Some were more ""deistic"" (God exists but is detached from humanity and not entirely personal) in nature, but these are only two major contributions of believers in the faith(s) you're putting down. . . That being said, religion has been abused for centuries, as long as man has had it. Any belief system can be abused, especially one that believes that some things are right and other things are wrong. (And the only systems that can't cause damage are those that have no absolute values to exploit -- so they don't do much anyway.). . And there's a lot of garbage going on in our culture right now, regarding religious people who use religion as a means to  control others rather than serve them. So that's frustrating for everyone. . . But I think that's more a problem with the people, than with the belief system(s)."
849221,Q0,849221_7,0.6666666666666666,7,'Why don't people understand that history often repeats itself?',People who have faith in their religion think there is no wrong in their religion.  They don't see how it can repeat itself although it does anyway.
849221,Q0,849221_6,0.3333333333333333,6,'Why don't people understand that history often repeats itself?',I agree there's going to be another dark age & it's going to be a lot worser that we've ever seen before. Man does not know the way to peace everytime our leader open their mouths & start talking about peace there's a war. Although  I still believe in Jesus as my Lord & Savior some of what you say is true. We've had WWI & WWII since that time more wars have been fought.
849221,Q0,849221_5,0.3333333333333333,5,'Why don't people understand that history often repeats itself?',"You assume a lot for someone who's never been in a church.. . ""I know there is about to be another dark age if people are not careful. I can tell."" ... Really, how can YOU tell, are you some sort of prophet of God?  Do you have a PhD in theology?  Let's see some credentials please!. . ""people are just too closed minded and stubborn to see it or care"" ... what people are you referring to?  Are you intimate with these people, did you do a study or a poll?. . ""theyd rather focus on an old religion thats caused nothing but harm to everyone in and around it."" ... Again, how do you know that this is what ""they"" are doing?  Did you do a study and ask a sampling of the religious population what their focus is on?. . Your generalize and assume based on no actual fact, and expect us to believe you?  Your question is moot, as you cannot even provide one fact or shred of evidence to support yourself, other than whats in your own lonely mind.. . So the answer is ... people don't realize it  because it's not happening, you are delusional."
849221,Q0,849221_4,0.3333333333333333,4,'Why don't people understand that history often repeats itself?',Sure history will repeat itself. Jesus one day will walk the Earth once again. This whole believer/non-believer issue will be sorted out once and for all.
849221,Q0,849221_3,0.3333333333333333,3,'Why don't people understand that history often repeats itself?',"Yep everyone is totally my way is the right way and you'll like it or DIE!   Makes me sick..... . There are way too many religions in this world to pick one and go with it.  Everyone claims that if you don't believe in religion you're going to be reincarnated or go to hell or whatever.... Well, personally, since there is no clear way of choosing which is the correct religion and if I pick wrong I'm doomed anyways, I'd rather pick None of the above and not side with any of those close minded groups that seem to think they know better than everyone else."
849221,Q0,849221_2,0.3333333333333333,2,'Why don't people understand that history often repeats itself?',"You're right...""history repeats itself"" and...Christ WILL return! Why not try reading and STUDYING the Bible?"
849221,Q0,849221_1,0.6666666666666666,1,'Why don't people understand that history often repeats itself?',Because they BELIEVE so much and have so much FAITH that they can not accept what history has proven.. . They are so caught up in a book that they have read that they are oblivious to what really happens on this planet.
849221,Q0,849221_0,0.3333333333333333,0,'Why don't people understand that history often repeats itself?',"Maybe we are nearing the end of the age ,or the begining of the end.. It will only get worse from now on,and then the end will come."
849221,Q0,849221_12,0.0,12,'Why don't people understand that history often repeats itself?',"Kero darling, History isn't the only thing that repeats itself.  You sound like a broken record.  I really like your new picture."
849221,Q0,849221_11,0.3333333333333333,11,'Why don't people understand that history often repeats itself?',"Just like fat people who can't stop buying another snickers bar.  It feels to good, not to pay attention to reality.. People have needs that aren't fulfilled through supernatural teachings thus they need more super-naturalism etc.  Its all about them, the larger picture comes last if ever."
849221,Q0,849221_10,0.3333333333333333,10,'Why don't people understand that history often repeats itself?',"Actually we are probably already in the dark age as far as religion is concerned.  Don't you find it amazing that some people come on here and condemn you and claim that they know you have never been in a church, but then want to know how you can claim something because you don't know the people your talking about.  And then they want credentials and facts, but if you give it to them then they continue to say ""how do you know, how do you know they are right"".  There is no sense in trying to have an intellectual debate with them because they are totally illogical."
849221,Q0,849221_16,0.3333333333333333,16,'Why don't people understand that history often repeats itself?',History always has a way of repeating it's self. not believing it won't keep that from happeing.
849221,Q0,849221_15,0.0,15,'Why don't people understand that history often repeats itself?',yikes - Nothing but harm to everyone in it and around it. . you list ignorance as one of your dislikes - please do something about that....and what is wrong with fur?  my dog loves his....
849221,Q0,849221_14,0.0,14,'Why don't people understand that history often repeats itself?',Im sad still that the hate is continuing to build up inside you.  I wish that there was something I could do for you! I really do!!  I'm sure you were a really nice person at one time.  I wonder if there is still a chance to make a change and just move on with your life and start to enjoy it instead of wasting so much time wondering why people act like they do... Oh I know! You could go to college for behavioral therapy and learn to help others and unknowingly help yourself as well.
765138,U0,765138_0,1.0,0,'Why does having strong feelings for someone make you feel bad?',"We often forget that true love is selfless,i.e. in true love one is not supposed to expect anything from the person one loves.. But we start expecting things and when that dosen't happen we assume that our love is hurting us, but the fact is you are goin by the wrong rules.. So true love never hurts, cause its not supposed to."
765138,Q0,765138_10,0.3333333333333333,10,'Why does having strong feelings for someone make you feel bad?',"Truly loving someone should not hurt at all. If your experiencing pain in your relationship with someone, there are other issues with trust, jealousy, or insecurity with yourself that need to be resolved."
765138,E0,765138_13,1.0,13,'Why does having strong feelings for someone make you feel bad?',"Every reactions has an equal opposite reaction so the more you love someone,the more they can hurt you."
765138,Q0,765138_12,0.6666666666666666,12,'Why does having strong feelings for someone make you feel bad?',"Reason is powerless in the expression of Love. Love alone is capable of revealing the truth of Love and being a Lover. If you want to live, die in Love; die in Love if you want to remain alive. . Leave all worries behind and make your heart totally pure, like the face of a mirror with no image or design. Once your heart is cleansed of all images, it will contain them all... You are the son of the moment, you are young,you have vanquished time. This short present moment must not be wasted."
765138,Q0,765138_14,0.3333333333333333,14,'Why does having strong feelings for someone make you feel bad?',i dont know ..but when u argue with the one you love it tears u apart where as u argue with a friend..it is so much different..
765138,Q0,765138_9,0.6666666666666666,9,'Why does having strong feelings for someone make you feel bad?',Because you are afraid not to lose her.
765138,Q0,765138_8,0.6666666666666666,8,'Why does having strong feelings for someone make you feel bad?',"It would hurt like hell if that someone doesn't love you in return. But true love doesn't go one way, it goes both ways. And in true love you would be happy for that person you love even if it means he/she is happier with someone else."
765138,Q0,765138_1,1.0,1,'Why does having strong feelings for someone make you feel bad?',that means you really are experiencing the true meaning of love
765138,Q0,765138_3,0.3333333333333333,3,'Why does having strong feelings for someone make you feel bad?',perhaps because you love that someone like heaven...
765138,Q0,765138_2,0.3333333333333333,2,'Why does having strong feelings for someone make you feel bad?',bcoz love is 'HANDICAPPED'
765138,Q0,765138_5,0.0,5,'Why does having strong feelings for someone make you feel bad?',Probably because you are not using a personal lubricant.. . May I suggest Astroglide?
765138,Q0,765138_4,0.6666666666666666,4,'Why does having strong feelings for someone make you feel bad?',Excessive involvement in others life may be hurtful.
765138,Q0,765138_7,0.6666666666666666,7,'Why does having strong feelings for someone make you feel bad?',caus lovin means sacrifice and v r'nt used 2 sacrifices.v want to giv and still keep. conflict of ideology. love means givin som1 the best and yet havin the best of him/her.
765138,Q0,765138_6,0.3333333333333333,6,'Why does having strong feelings for someone make you feel bad?',"I don`t know, but I`m glad that I have and still do experience it!!!"
765138,Q0,765138_11,0.6666666666666666,11,'Why does having strong feelings for someone make you feel bad?',"Yes,loving hurts when we understand and experience love is not an easy game,but the one which has to be gone through many many obstacles and sufferings."
3496147,U0,3496147_0,1.0,0,'Why did I get in trouble for being Christian?',"Ah, but by letting you suffer, the Lord IS letting you follow Jesus' example.  You haven't gone wrong.  See?"
